{
  "$schema": "https://json-schema.org/draft/2020-12/schema",
  "title": "unpack",
  "type": "object",
  "additionalProperties": false,
  "required": [
    "schema_version",
    "stage",
    "sample",
    "status",
    "summary",
    "findings",
    "artifacts",
    "investigation_targets",
    "limitations",
    "upstream_inputs",
    "recovery_status",
    "packing",
    "rounds",
    "static_pass2_handoff"
  ],
  "properties": {
    "schema_version": {
      "const": "1.0"
    },
    "stage": {
      "const": "unpack"
    },
    "sample": {
      "type": "object",
      "additionalProperties": false,
      "required": [
        "original_sha256",
        "target_path",
        "target_sha256"
      ],
      "properties": {
        "original_sha256": {
          "type": "string",
          "pattern": "^[A-Fa-f0-9]{64}$"
        },
        "target_path": {
          "type": [
            "string",
            "null"
          ]
        },
        "target_sha256": {
          "type": [
            "string",
            "null"
          ],
          "pattern": "^[A-Fa-f0-9]{64}$"
        }
      }
    },
    "status": {
      "enum": [
        "completed",
        "partial",
        "blocked",
        "failed",
        "not_needed"
      ]
    },
    "summary": {
      "type": "string"
    },
    "findings": {
      "type": "array",
      "items": {
        "$ref": "#/$defs/finding"
      }
    },
    "artifacts": {
      "type": "array",
      "items": {
        "$ref": "#/$defs/artifact"
      }
    },
    "investigation_targets": {
      "type": "array",
      "items": {
        "$ref": "#/$defs/target"
      }
    },
    "limitations": {
      "type": "array",
      "items": {
        "type": "string"
      }
    },
    "upstream_inputs": {
      "type": "array",
      "items": {
        "type": "string"
      }
    },
    "recovery_status": {
      "enum": [
        "not_needed",
        "success",
        "partial",
        "blocked",
        "failed_validation"
      ]
    },
    "packing": {
      "type": "object",
      "additionalProperties": false,
      "required": [
        "detected",
        "type",
        "confidence"
      ],
      "properties": {
        "detected": {
          "type": "boolean"
        },
        "type": {
          "type": [
            "string",
            "null"
          ]
        },
        "confidence": {
          "type": "number",
          "minimum": 0,
          "maximum": 1
        }
      }
    },
    "rounds": {
      "type": "array",
      "items": {
        "type": "object",
        "additionalProperties": false,
        "required": [
          "round",
          "strategy",
          "source",
          "destination",
          "transform",
          "handoff",
          "result"
        ],
        "properties": {
          "round": {
            "type": "integer",
            "minimum": 1
          },
          "strategy": {
            "type": "string"
          },
          "source": {
            "type": [
              "string",
              "null"
            ]
          },
          "destination": {
            "type": [
              "string",
              "null"
            ]
          },
          "transform": {
            "type": [
              "string",
              "null"
            ]
          },
          "handoff": {
            "type": [
              "string",
              "null"
            ]
          },
          "result": {
            "enum": [
              "success",
              "partial",
              "failed",
              "blocked"
            ]
          }
        }
      }
    },
    "static_pass2_handoff": {
      "type": "object",
      "additionalProperties": false,
      "required": [
        "recommended",
        "artifact_id",
        "artifact_path",
        "artifact_sha256",
        "artifact_type",
        "candidate_entry",
        "runtime_base",
        "image_base",
        "repair_limitations",
        "questions"
      ],
      "properties": {
        "recommended": {
          "type": "boolean"
        },
        "artifact_id": {
          "type": [
            "string",
            "null"
          ]
        },
        "artifact_path": {
          "type": [
            "string",
            "null"
          ]
        },
        "artifact_sha256": {
          "type": [
            "string",
            "null"
          ],
          "pattern": "^[A-Fa-f0-9]{64}$"
        },
        "artifact_type": {
          "type": [
            "string",
            "null"
          ]
        },
        "candidate_entry": {
          "type": [
            "string",
            "null"
          ]
        },
        "runtime_base": {
          "type": [
            "string",
            "null"
          ]
        },
        "image_base": {
          "type": [
            "string",
            "null"
          ]
        },
        "repair_limitations": {
          "type": "array",
          "items": {
            "type": "string"
          }
        },
        "questions": {
          "type": "array",
          "items": {
            "type": "string"
          }
        }
      }
    }
  },
  "$defs": {
    "source": {
      "type": "object",
      "additionalProperties": false,
      "required": [
        "stage",
        "artifact",
        "location"
      ],
      "properties": {
        "stage": {
          "type": "string"
        },
        "artifact": {
          "type": [
            "string",
            "null"
          ]
        },
        "location": {
          "type": [
            "string",
            "null"
          ]
        }
      }
    },
    "evidence": {
      "type": "object",
      "additionalProperties": false,
      "required": [
        "id",
        "kind",
        "source",
        "observation"
      ],
      "properties": {
        "id": {
          "type": "string"
        },
        "kind": {
          "enum": [
            "static",
            "dynamic",
            "memory",
            "artifact",
            "tool_output",
            "external",
            "analyst"
          ]
        },
        "source": {
          "$ref": "#/$defs/source"
        },
        "observation": {
          "type": "string"
        },
        "address": {
          "type": [
            "string",
            "null"
          ]
        },
        "confidence": {
          "type": "number",
          "minimum": 0,
          "maximum": 1
        }
      }
    },
    "finding": {
      "type": "object",
      "additionalProperties": false,
      "required": [
        "id",
        "title",
        "category",
        "status",
        "confidence",
        "description",
        "reasoning",
        "sources",
        "evidence",
        "limitations"
      ],
      "properties": {
        "id": {
          "type": "string",
          "pattern": "^[a-z0-9][a-z0-9._-]*$"
        },
        "title": {
          "type": "string"
        },
        "category": {
          "enum": [
            "sample_identity",
            "packing",
            "loader",
            "execution",
            "anti_analysis",
            "persistence",
            "filesystem",
            "registry",
            "process",
            "injection",
            "network",
            "credential_access",
            "collection",
            "exfiltration",
            "impact",
            "configuration",
            "ioc",
            "other"
          ]
        },
        "status": {
          "enum": [
            "observed",
            "confirmed",
            "partial",
            "inferred",
            "hypothesized",
            "not_observed",
            "contradicted",
            "rejected",
            "unknown"
          ]
        },
        "confidence": {
          "type": "number",
          "minimum": 0,
          "maximum": 1
        },
        "description": {
          "type": "string"
        },
        "reasoning": {
          "type": "string"
        },
        "sources": {
          "type": "array",
          "minItems": 1,
          "items": {
            "$ref": "#/$defs/source"
          }
        },
        "evidence": {
          "type": "array",
          "items": {
            "$ref": "#/$defs/evidence"
          }
        },
        "limitations": {
          "type": "array",
          "items": {
            "type": "string"
          }
        }
      }
    },
    "target": {
      "type": "object",
      "additionalProperties": false,
      "required": [
        "id",
        "priority",
        "target",
        "reason",
        "recommended_action",
        "success_criteria"
      ],
      "properties": {
        "id": {
          "type": "string"
        },
        "priority": {
          "type": "integer",
          "minimum": 1,
          "maximum": 5
        },
        "target": {
          "type": "string"
        },
        "reason": {
          "type": "string"
        },
        "recommended_action": {
          "type": "string"
        },
        "success_criteria": {
          "type": "string"
        }
      }
    },
    "artifact": {
      "type": "object",
      "additionalProperties": false,
      "required": [
        "id",
        "path",
        "sha256",
        "type",
        "validation_status",
        "context"
      ],
      "properties": {
        "id": {
          "type": "string"
        },
        "path": {
          "type": [
            "string",
            "null"
          ]
        },
        "sha256": {
          "type": [
            "string",
            "null"
          ],
          "pattern": "^[A-Fa-f0-9]{64}$"
        },
        "type": {
          "type": "string"
        },
        "validation_status": {
          "enum": [
            "validated",
            "partial",
            "failed",
            "not_validated",
            "not_applicable"
          ]
        },
        "context": {
          "type": "string"
        }
      }
    }
  }
}