{
  "schema_version": "1.0",
  "stage": "unpack",
  "sample": {
    "original_sha256": "0000000000000000000000000000000000000000000000000000000000000000",
    "target_path": "C:/analysis/sample.exe",
    "target_sha256": "0000000000000000000000000000000000000000000000000000000000000000"
  },
  "status": "not_needed",
  "summary": "No credible packing evidence.",
  "findings": [],
  "artifacts": [],
  "investigation_targets": [],
  "limitations": [],
  "upstream_inputs": [
    "02-static-pass1.json"
  ],
  "recovery_status": "not_needed",
  "packing": {
    "detected": false,
    "type": null,
    "confidence": 0.9
  },
  "rounds": [],
  "static_pass2_handoff": {
    "recommended": false,
    "artifact_id": null,
    "artifact_path": null,
    "artifact_sha256": null,
    "artifact_type": null,
    "candidate_entry": null,
    "runtime_base": null,
    "image_base": null,
    "repair_limitations": [],
    "questions": []
  }
}